"FilingID","Initial/Amended","11.A(1)","11.A(2)","11.B(1)","11.B(2)","Filed Against","ReferenceID","Remove-Affiliate","Remove-Expired","Remove-Filed in Error","Error Explantion","Affiliate Submitted","Organization","Court","Date First Charged","Charged Date Exact","First Charged Explanation","Event Detail","Felony","Status","Status Date","Status Date Exact","Status Date Explanation","Disposition","Summary"
1010604,"AMENDED","","Y","","","Affiliates",1002357,"","","","","N","N/A","US DISTRICT COURT FOR THE SOUTHERN DISTRICT OF FLORIDA, 10-20907-CR","12/27/2010","Y","","FOLLOWING AN INVESTIGATION INTO POSSIBLE VIOLATIONS BY ALCATEL LUCENT (""ALU"") OF THE FOREIGN CORRUPT PRACTICES ACT (""FCPA"") AND FEDERAL SECURITIES LAWS, IN DEC 2010 ALU ENTERED INTO SETTLEMENT AGREEMENTS WITH THE DOJ AND SEC. AS PART OF THOSE AGREEMENTS, THREE ALU SUBSIDIARIES EACH PLED GUILTY TO CONSPIRACY TO VIOLATE ANTIBRIBERY, BOOKS AND RECORDS AND INTERNAL ACCOUNTING CONTROLS PROVISIONS. ALU ALSO SIGNED A 3 YEAR DEFERRED PROSECUTION AGREEMENT (DPA) PURSUANT TO WHICH THE PROSECUTION OF THE ALLEGED VIOLATIONS OF THE FCPA WOULD BE DEFERRED AND PAID A US $92M CRIMINAL FINE. THE DPA REQUIRED THE ENGAGEMENT OF A COMPLIANCE MONITOR.  ON 12/8/14, THE MONITOR SUBMITTED HIS FINAL REPORT AND CERTIFIED THAT ALU'S COMPLIANCE PROGRAM IS REASONABLY DESIGNED AND IMPLEMENTED TO PREVENT AND DETECT VIOLATIONS OF ANTI-CORRUPTION LAWS.  SUBSEQUENTLY, THE DOJ MOVED TO DISMISS WITH PREJUDICE THE FPCA CHARGES UNDERLYING THE DPA, WHICH THE COURT GRANTED ON 2/9/15. FOR MORE, SEE ALU'S FORMS 20-F AND 6-K.","Y","Final","02/09/2015","Y","","SEE ITEM 3B","SEE ITEM 3B"
1010604,"INITIAL","","Y","","","Affiliates",1021746,"","","","","N","N/A","COURT OF APPEAL.  PARIS, FRANCE.  INVESTIGATION NUMBER 2203/07/3.","05/24/2016","Y","","IN A DECISION DATED 24 MAY 2016, A FRENCH INVESTIGATING MAGISTRATE DETERMINED THAT ALCATEL-LUCENT SA HAS TO STAND TRIAL FOR ALLEGEDLY VIOLATING SECT. 435-3 OF THE FRENCH CRIMINAL CODE (AS THEN IN FORCE) IN CONNECTION WITH CONTRACTS OBTAINED IN 2001-2004 WITH THE COSTA RICAN NATIONAL TELECOMMUNICATIONS OPERATOR (""ICE"").  THIS DECISION IS THE RESULT OF THE INVESTIGATION BY FRENCH AUTHORITIES, AND THE CHARGES ARE BASED ON THE SAME CONDUCT IN COSTA RICA THAT LED TO ALCATEL-LUCENT'S 2010 SETTLEMENT UNDER THE FOREIGN CORRUPT PRACTICES ACT WITH THE SEC AND THE US DEPARTMENT OF JUSTICE. IF FOUND GUILTY, THE MAXIMUM PENALTY WOULD BE 750,000 EURO (I.E., THE APPLICABLE FINE AT THE TIME OF THE OFFENSE) AND/OR THIS SUBSIDIARY'S DEBARMENT FROM PARTICIPATION IN FRENCH PUBLIC PROCUREMENT CONTRACTS.","Y","Pending","","","","SEE ITEM 3B","SEE ITEM 3B"
1019808,"AMENDED","Y","","","","Affiliates",1009525,"","","","","N","THE CHARGES WERE BROUGHT AGAINST JPMORGAN CHASE & CO. (""JPMC"").  JPMC IS AN INVESTMENT-RELATED BUSINESS AND IS THE ULTIMATE PARENT OF THE REGISTRANT.","UNITED STATES DISTRICT COURT FOR THE DISTRICT OF CONNECTICUT (""DISTRICT COURT""), 3:15-CR-79 (SRU)","05/20/2015","Y","","JPMC WAS CHARGED WITH A ONE COUNT FELONY CRIME CHARGE IN VIOLATION OF THE SHERMAN ANTITRUST ACT, 15 U.S.C. SECTION 1 RELATING TO THE FOREIGN CURRENT EXCHANGE SPOT MARKET (""FX SPOT MARKET"").  JPMC PLED GUILTY PURSUANT TO A PLEA AGREEMENT WITH THE DOJ.","Y","Final","05/20/2015","Y","","JPMC ENTERED A GUILTY PLEA ON MAY 20, 2015 PURSUANT TO A PLEA AGREEMENT WITH THE DOJ.  JPMC AGREED TO PAY A CRIMINAL FINE OF $550 MILLION AND A MANDATORY ASSESSMENT OF $400.  JPMC AGREED TO BE SUBJECT TO PROBATION FOR 3 YEARS.  THE SENTENCING DATE HAS NOT YET OCCURRED.","ON MAY 20, 2015, THE DOJ FILED A CRIMINAL INFORMATION IN THE DISTRICT COURT CHARGING JPMC WITH A ONE COUNT CRIME CHARGE IN VIOLATION OF THE SHERMAN ANTITRUST ACT, 15 U.S.C. § 1 (THE ""INFORMATION"").  THE INFORMATION CHARGES THAT, FROM JULY 2010 UNTIL AT LEAST JANUARY 2013, JPMC, THROUGH ONE OF ITS EURO/U.S. DOLLAR (""EUR/USD"") TRADERS, ENTERED INTO AND ENGAGED IN A CONSPIRACY TO FIX, STABILIZE, MAINTAIN, INCREASE OR DECREASE THE PRICE OF, AND RIG BIDS AND OFFERS FOR, THE EUR/USD CURRENCY PAIR EXCHANGED IN THE FX SPOT MARKET BY AGREEING TO ELIMINATE COMPETITION IN THE PURCHASE AND SALE OF THE EUR/USD CURRENCY PAIR IN THE U.S. AND ELSEWHERE."
1021381,"AMENDED","Y","Y","","","Affiliates",1010857,"","","","","N","NOT APPLICABLE","CASE NO. 7604 OF 2015, SHARJAH FEDERAL COURT OF FIRST INSTANCE, THIRD PENAL CIRCUIT, SHARJAH, UNITED ARAB EMIRATES","07/21/2015","N","DATE OBTAINED FROM COURT RECORD.  MR GRAHAM WAS NOT NOTIFIED OF THE CHARGE BEFORE TRIAL.","ONE COUNT OF 'BREACH OF TRUST', A CHARGE EQUIVALENT TO A FELONY IN SHARJAH COURT.  THE CHARGE IS NOT INVESTMENT- RELATED AND MR. GRAHAM WAS NOT GIVEN THE OPPORTUNITY TO ENTER A PLEA.  MR. GRAHAM WAS NOT INFORMED OF THE CHARGE, TRIAL DATE NOR THE CONVICTION BY THE SHARJAH COURT.  HE WAS ALERTED TO THE CONVICTION BY A THIRD PARTY AND THEN PROMPTLY SUBMITTED A FORMAL REQUEST FOR THE COURT DOCUMENTS. ON NOVEMBER 16, 2015, HE FINALLY RECEIVED DETAILS OF THE JUDGMENT FROM THE SHARJAH COURT AND SUBSEQUENTLY HAD THE FULL COURT DOCUMENTS TRANSLATED.","Y","On Appeal","08/13/2015","Y","","MR. GRAHAM WAS CONVICTED IN ABSENTIA ON AUGUST 13, 2015.  THE CONVICTION CARRIES A SENTENCE OF THREE YEARS IMPRISONMENT.  IT IS OAKTREE'S UNDERSTANDING THAT DEFENDANTS CONVICTED IN ABSENTIA IN SHARJAH COURT ARE ENTITLED TO A FULL RETRIAL, AND MR. GRAHAM IS CONSIDERING CHALLENGING THE CONVICTION OF WHICH HE HAD NO NOTICE NOR ANY OPPORTUNITY TO PUT FORWARD A DEFENSE.  OAKTREE DOES NOT CONSIDER THE CONVICTION TO HAVE ANY MERIT.","A FUND MANAGED BY OAKTREE INVESTED IN A GROUP OF COMPANIES CALLED THE GULMAR GROUP IN AUGUST 27, 2010.  THE GULMAR GROUP WAS IN FINANCIAL DISTRESS AND, IN DECEMBER 2011, MOST OF THE GROUP WENT INTO ADMINISTRATION.  GULMAR OFFSHORE OIL COMPANY LLC (GOME), A SHARJAH COMPANY, WAS PART OF THE GULMAR GROUP, BUT DID NOT GO INTO ADMINISTRATION AT THAT TIME.  IN 2012, MR. GRAHAM WAS APPOINTED MANAGING DIRECTOR OF GOME, WHICH WAS ENGAGED IN AN ONGOING ARBITRATION RELATING TO CERTAIN VESSELS THAT HAD BEEN UNLAWFULLY SEIZED.  UNDER MR. GRAHAM'S LEADERSHIP, GOME RECEIVED AN AWARD IN THE ARBITRATION AND WAS ABLE TO RECOVER FUNDS RELATING TO THE AWARD.  GOME SUBSEQUENTLY APPLIED FOR A VOLUNTARY BANKRUPTCY PROCEDURE (ADMINISTRATION) IN THE HIGH COURT IN LONDON ON JUNE 16, 2015.  JEAN-MICHEL TISSIER, A FORMER GOME DIRECTOR, CLAIMS TO BE ENTITLED TO MONIES RECOVERED BY GOME IN THE ARBITRATION, ALONG WITH OTHER FUNDS. THROUGH COMMUNICATION WITH MR. GRAHAM AND THE GOME ADMINISTRATORS, HE HAS MADE NUMEROUS DEMANDS TO GOME AND OAKTREE THAT OAKTREE AND MR. GRAHAM VIEW AS UNJUSTIFIED. HE SUED GOME IN CIVIL COURT IN SHARJAH FOR RECOVERY OF SOME OF THESE FUNDS.    MR TISSIER THEN MADE A CRIMINAL COMPLAINT IN SHARJAH COURT ALLEGING THAT MR. GRAHAM HAD STOLEN MONIES FROM GOME.    MR. GRAHAM DID NOT RECEIVE ANY NOTICE OF THE CHARGE AND THEREFORE DID NOT APPEAR AND HAD NO OPPORTUNITY TO PRESENT EVIDENCE.  HE WAS FOUND GUILTY IN ABSENTIA BY THE COURT ON  AUGUST 13, 2015, THOUGH HE WAS NOT NOTIFIED OF THIS CONVICTION BY THE COURT AND DID NOT RECEIVE DETAILS THEREOF UNTIL  NOVEMBER 16, 2015, AFTER HE WAS ALERTED TO THE CONVICTION BY A THIRD PARTY AND SUBMITTED A FORMAL REQUEST FOR THE COURT DOCUMENTS.  HE AND OAKTREE CONSIDER THE CRIMINAL CONVICTION MERITLESS AND ENTIRELY UNJUSTIFIED, AND MR. GRAHAM IS CONSIDERING CHALLENGING THE CONVICTION."
1021781,"AMENDED","","Y","","","Affiliates",1011032,"","","","","N","THE CRIMINAL PROCEEDINGS FILED INVOLVE CERTAIN EMPLOYEES OF AN AFFILIATE IN BRAZIL (""BRAZIL AFFILIATE"").","PROCEEDINGS ARE BEING CONDUCTED BY THE PUBLIC ATTORNEY'S OFFICE OF THE STATE OF SÃO PAULO, BEFORE LOWER COURTS AND THE COURT OF APPEALS OF THE STATE OF SÃO PAULO. CRIMINAL CHARGES HAVE BEEN FILED.  THE CASE NUMBER IS 0058695-74.2012.8.26.0050.","02/15/2013","Y","MR. LIMA AND MR. VASCONCELOS, EMPLOYEES OF THE BRAZIL AFFILIATE, WERE CHARGED WITH MISCONDUCT INVOLVING PERMITS AND LICENSES GRANTED FOR EXPANSIONS AND RENOVATIONS OF SHOPPING MALLS IN A CRIMINAL LAWSUIT FILED AGAINST THEM IN NOVEMBER 2012. IN BRAZIL, A CRIMINAL LAWSUIT IS DEEMED OFFICIAL WHEN THE JUDGE ACCEPTS IT; THE JUDGE'S ACCEPTANCE OF THE CRIMINAL LAWSUIT TOOK PLACE ON FEBRUARY 15, 2013.","THE PUBLIC PROSECUTOR HAS CHARGED MR. LIMA AND MR. VASCONCELOS WITH USING THIRD PARTY CONSULTANTS TO PAY BRIBES TO A PUBLIC OFFICIAL AND A REPRESENTATIVE OF THE CITY OF SÃO PAULO WITH THE PURPOSE OF (A) OBTAINING LICENSES FOR THE CONSTRUCTION OF A SHOPPING MALL EXPANSION; (B) REDUCING THE AMOUNT OF A MUNICIPAL TAX THAT SHOULD HAVE BEEN PAID IN ORDER TO GET THE RIGHT TO CONSTRUCT ABOVE THE CONSTRUCTION LIMITS OF THE CITY'S ZONE WHERE THE MALLS ARE LOCATED; AND (C) NOT INCLUDING CERTAIN MALLS IN THE FINAL REPORT OF THE PARLIAMENTARY COMMISSION OF INQUIRY HELD WITHIN THE CHAMBER OF ALDERMEN OF THE CITY OF SÃO PAULO. THE CHARGES INCLUDE CONCURRENT OFFENSES OF CONSPIRACY & BRIBERY, WHICH ARE BOTH CONSIDERED FELONIES. THE EMPLOYEES OF THE BRAZIL AFFILIATE NAMED IN THE CRIMINAL LAWSUIT DENY ANY WRONGDOING.","Y","Pending","","","","THE JUDGE'S ACCEPTANCE OF THE CRIMINAL LAWSUIT AGAINST MR. LIMA AND MR. VASCONCELOS TOOK PLACE ON FEBRUARY 15, 2013, AND PRE-TRIAL HEARINGS ARE IN PROGRESS.","THE CURRENT PROCEEDINGS INVOLVE ALLEGATIONS MADE AGAINST MR. LIMA, MR. VASCONCELOS AND OTHERS OF MISCONDUCT REGARDING CERTAIN PERMITS AND LICENSES GRANTED BETWEEN 2008 AND THE END OF 2009 FOR EXPANSIONS AND RENOVATIONS OF SHOPPING MALLS IN BRAZIL.  THE ALLEGATIONS WERE MADE BY A FORMER EMPLOYEE OF THE BRAZIL AFFILIATE WHO WAS TERMINATED FOR FRAUD AND AGAINST WHOM THERE IS AN ONGOING LAWSUIT AND CRIMINAL INVESTIGATION. THE ALLEGATIONS WERE THAT PAYMENTS MADE TO MUNICIPAL PLANNING CONSULTANTS HIRED DURING MALL CONSTRUCTION EXPANSION TO OBTAIN THE NECESSARY LICENSES AND PERMITS, AND ENSURE THAT PROJECTS ADHERE TO MUNICIPAL CODES AND REGULATIONS,  WERE USED BY THEM TO BRIBE MUNICIPAL OFFICIALS.  THE PUBLIC PROSECUTOR'S OFFICE IN SAO PAULO INITIATED A LAWSUIT BEFORE THE COURT IN NOVEMBER 2012 AGAINST A MUNICIPAL OFFICIAL, REAL ESTATE CONSULTANTS, MR. LIMA, MR. VASCONCELOS AND OTHERS ASSOCIATED WITH THE BRAZIL AFFILIATE, WHICH WAS ACCEPTED BY THE JUDGE AS OF FEBRUARY 15, 2013.  BROOKFIELD BROUGHT THE ALLEGATIONS TO THE ATTENTION OF THE RISK MANAGEMENT COMMITTEE OF ITS BOARD OF DIRECTORS AND LAUNCHED AN INDEPENDENT  INVESTIGATION BY A MAJOR NEW YORK BASED LAW FIRM TO ASCERTAIN IF THERE WAS ANY EVIDENCE TO SUPPORT THE ALLEGATIONS.  THE EIGHT MONTH INVESTIGATION WAS COMPREHENSIVE AND THOROUGH.  THE INVESTIGATION IS COMPLETE AND THE INFORMATION AVAILABLE DOES NOT SUPPORT THE PAYMENTS MADE BY THE BRAZIL AFFILIATE TO CONSULTANTS WERE USED TO PAY BRIBES TO MUNICIPAL OFFICIALS."
1024605,"AMENDED","","","","Y","Affiliates",1013791,"","","","","Y","","","","","","","","","","","","",""
1025164,"INITIAL","Y","","","","Affiliates",1688951,"","","","","N","JPMORGAN CHASE & CO. (""JPMC"")","UNITED STATES DISTRICT COURT FOR THE DISTRICT OF CONNECTICUT (""DISTRICT COURT""), 3:15-CR-79 (SRU)","05/20/2015","Y","","JPMC WAS CHARGED WITH A ONE COUNT FELONY CRIME CHARGE IN VIOLATION OF THE SHERMAN ANTITRUST ACT, 15 U.S.C. SECTION 1 RELATING TO THE FOREIGN CURRENCY EXCHANGE SPOT MARKET (""FX SPOT MARKET"").  JPMC PLED GUILTY PURSUANT TO A PLEA AGREEMENT WITH THE DOJ.","Y","Final","05/20/2015","Y","","JPMC ENTERED A GUILTY PLEA ON MAY 20, 2015 PURSUANT TO A PLEA AGREEMENT WITH THE DOJ.  JPMC AGREED TO PAY A CRIMINAL FINE OF $550 MILLION AND A MANDATORY ASSESSMENT OF $400.  JPMC AGREED TO BE SUBJECT TO PROBATION FOR 3 YEARS.  THE SENTENCING DATE HAS NOT YET OCCURRED.","ON MAY 20, 2015, THE DOJ FILED A CRIMINAL INFORMATION IN THE DISTRICT COURT CHARGING JPMC WITH A ONE COUNT CRIME CHARGE IN VIOLATION OF THE SHERMAN ANTITRUST ACT, 15 U.S.C. § 1 (THE ""INFORMATION"").  THE INFORMATION CHARGES THAT, FROM JULY 2010 UNTIL AT LEAST JANUARY 2013, JPMC, THROUGH ONE OF ITS EURO/U.S. DOLLAR (""EUR/USD"") TRADERS, ENTERED INTO AND ENGAGED IN A CONSPIRACY TO FIX, STABILIZE, MAINTAIN, INCREASE OR DECREASE THE PRICE OF, AND RIG BIDS AND OFFERS FOR, THE EUR/USD CURRENCY PAIR EXCHANGED IN THE FX SPOT MARKET BY AGREEING TO ELIMINATE COMPETITION IN THE PURCHASE AND SALE OF THE EUR/USD CURRENCY PAIR IN THE U.S. AND ELSEWHERE."
1025164,"INITIAL","","","Y","Y","Affiliates",1482929,"","","","","N","HOMESALES, INC. ENGAGES IN INVESTMENT-RELATED (I.E., REAL ESTATE) BUSINESS AND IS A DIRECT SUBSIDIARY OF JPMORGAN CHASE & CO. UNDER COMMON CONTROL WITH (BUT NOT CONTROLLING OR CONTROLLED BY) J.P. MORGAN SECURITIES LLC.","CLEVELAND MUNICIPAL COURT; CLEVELAND, OHIO; 2008-CRB-041482.","12/01/2008","Y","","HOMESALES, INC. WAS CHARGED ON DECEMBER 1, 2008 WITH VIOLATING CITY OF CLEVELAND HOUSING CODE SECTIONS 371.01, 3103.09, 3103.20, 369.06, 369.09, 369.13, 369.15, AND 369.16.  SUCH VIOLATIONS ARE MISDEMEANORS UNDER CLEVELAND LAW.  ON AUGUST 10, 2009, A MORTGAGE SERVICER, ON BEHALF OF HOMESALES, INC., ENTERED A PLEA OF ""NOT GUILTY.""  ON DECEMBER 1, 2009, THE MORTGAGE SERVICER, ON BEHALF OF HOMESALES, INC., CHANGED THE PLEA TO ""NO CONTEST.""","N","Pending","","","","THE COURT ACCEPTED THE ""NO CONTEST"" PLEA AND FOUND HOMESALES, INC. GUILTY ON DECEMBER 1, 2009.  THE COURT ASSESSED A $55,000.00 FINE ON THE SAME DATE.  ON AUGUST 12, 2010, THE MORTGAGE SERVICER, ON BEHALF OF HOMESALES, INC., FILED A MOTION TO MITIGATE THE FINE ON THE GROUNDS THAT IT ABATED THE NUISANCE BY DEMOLISHING THE PROPERTY.  THE COURT APPROVED THE MOTION AND THE FINE IS $5,215.00.  THE FINE HAS NOT YET BEEN PAID.","HOMESALES, INC., THE OWNER OF REAL ESTATE LOCATED IN CLEVELAND, OHIO, WAS CITED IN OCTOBER 2008 FOR VIOLATING CLEVELAND BUILDING AND HOUSING ORDINANCES, INCLUDING STRUCTURAL, MECHANICAL, AND AESTHETIC VIOLATIONS."
1025164,"INITIAL","","","Y","Y","Affiliates",1482930,"","","","","N","WM SPECIALTY MORTGAGE LLC ENGAGES IN INVESTMENT-RELATED (I.E., REAL ESTATE) BUSINESS AND IS AN INDIRECT SUBSIDIARY OF JPMORGAN CHASE & CO. UNDER COMMON CONTROL WITH (BUT NOT CONTROLLING OR CONTROLLED BY) J.P. MORGAN SECURITIES LLC.","CLEVELAND MUNICIPAL COURT; CLEVELAND, OHIO; 2008-CRB-028929.","08/27/2008","Y","","WM SPECIALTY MORTGAGE LLC WAS CHARGED ON AUGUST 27, 2008 WITH VIOLATING CITY OF CLEVELAND HOUSING CODE SECTIONS 371.01, 3103.09, 3103.21, 369.06, 369.07, 369.09, 369.12, 369.13, 369.14, 369.15, AND 369.16.  SUCH VIOLATIONS ARE MISDEMEANORS UNDER CLEVELAND LAW.  ON DECEMBER 15, 2008, A MORTGAGE SERVICER, ON BEHALF OF WM SPECIALTY MORTGAGE LLC, ENTERED A PLEA OF ""NOT GUILTY.""  ON AUGUST 20, 2009, THE MORTGAGE SERVICER, ON BEHALF OF WM SPECIALTY MORTGAGE LLC, CHANGED THE PLEA TO ""NO CONTEST.""","N","Final","08/20/2009","Y","","THE COURT ACCEPTED THE ""NO CONTEST"" PLEA AND FOUND  WM SPECIALTY MORTGAGE LLC GUILTY ON AUGUST 20, 2009.  THE COURT ASSESSED A FINE OF $30,000.00 PLUS THE COST OF THE ACTION ON THE SAME DATE.  THE COURT SUSPENDED $24,000.00 OF THE FINE ON SEPTEMBER 24, 2009 AND DIRECTED WM SPECIALTY MORTGAGE LLC TO REMEDY THE VIOLATIONS OR DEMOLISH THE PROPERTY AT ITS OWN EXPENSE.  WM SPECIALTY MORTGAGE LLC DEMOLISHED THE PROPERTY AT ITS OWN EXPENSE.  ON OR ABOUT FEBRUARY 3, 2010, THE REMAINING PORTION OF THE FINE WAS PAID AND THE CASE WAS CLOSED.","WM SPECIALTY MORTGAGE LLC, THE OWNER OF REAL ESTATE LOCATED IN CLEVELAND, OHIO, WAS CITED IN JULY 2008 FOR VIOLATING CLEVELAND BUILDING AND HOUSING ORDINANCES, INCLUDING STRUCTURAL, MECHANICAL, AND AESTHETIC VIOLATIONS."
1025164,"INITIAL","","","Y","Y","Affiliates",1482931,"","","","","N","EMC MORTGAGE CORPORATION ENGAGES IN INVESTMENT-RELATED (I.E., REAL ESTATE) BUSINESS AND IS AN INDIRECT SUBSIDIARY OF JPMORGAN CHASE & CO. UNDER COMMON CONTROL WITH (BUT NOT CONTROLLING OR CONTROLLED BY) J.P. MORGAN SECURITIES LLC.","CLEVELAND MUNICIPAL COURT; CLEVELAND, OHIO; 2009-CRB-011801.","04/24/2009","Y","","EMC MORTGAGE CORPORATION WAS CHARGED ON APRIL 24, 2009 WITH VIOLATING CITY OF CLEVELAND HOUSING CODE SECTIONS 3103.09, 369.06, 369.07, 369.09, 369.12, 369.13, 369.14, 369.15, 369.16, AND 369.19.  SUCH VIOLATIONS ARE MISDEMEANORS UNDER CLEVELAND LAW.  ON MAY 21, 2009, A MORTGAGE SERVICER, ON BEHALF OF EMC MORTGAGE CORPORATION, ENTERED A PLEA OF ""NOT GUILTY.""  ON SEPTEMBER 24, 2009, THE MORTGAGE SERVICER, ON BEHALF OF EMC MORTGAGE CORPORATION, CHANGED THE PLEA TO ""NO CONTEST.""","N","Pending","","","","THE COURT ACCEPTED THE ""NO CONTEST"" PLEA AND FOUND EMC MORTGAGE CORPORATION GUILTY ON SEPTEMBER 24, 2009.  THE COURT ASSESSED A FINE OF $50,000.00 PLUS THE COST OF THE ACTION ON THE SAME DATE.  THE FINE AMOUNT IS CURRENTLY OUTSTANDING.  ON FEBRUARY 17, 2010, A MORTGAGE SERVICER, ON BEHALF OF EMC MORTGAGE CORPORATION, FILED A MOTION TO MITIGATE THE FINE SINCE EMC MORTGAGE CORPORATION NO LONGER OWNS THE PROPERTY AND DOES NOT HAVE THE RIGHT TO CORRECT THE VIOLATIONS.  EMC MORTGAGE CORPORATION IS CURRENTLY AWAITING THE RULING OF THE COURT.","EMC MORTGAGE CORPORATION, THE OWNER OF REAL ESTATE LOCATED IN CLEVELAND, OHIO, WAS CITED ON AUGUST 29, 2008 FOR VIOLATING CLEVELAND BUILDING AND HOUSING ORDINANCES, INCLUDING STRUCTURAL, MECHANICAL, AND AESTHETIC VIOLATIONS."
1025164,"INITIAL","","","Y","Y","Affiliates",1482932,"","","","","N","WM SPECIALTY MORTGAGE LLC ENGAGES IN INVESTMENT-RELATED (I.E., REAL ESTATE) BUSINESS AND IS AN INDIRECT SUBSIDIARY OF JPMORGAN CHASE & CO. UNDER COMMON CONTROL WITH (BUT NOT CONTROLLING OR CONTROLLED BY) J.P. MORGAN SECURITIES LLC.","CLEVELAND MUNICIPAL COURT; CLEVELAND, OHIO; 2008-CRB-037404.","10/24/2008","Y","","WM SPECIALTY MORTGAGE LLC WAS CHARGED ON OCTOBER 24, 2008 WITH VIOLATING CITY OF CLEVELAND HOUSING CODE SECTIONS 3101.10, 369.13, AND 369.15.  SUCH VIOLATIONS ARE MISDEMEANORS UNDER CLEVELAND LAW.  ON AUGUST 4, 2009, A MORTGAGE SERVICER, ON BEHALF OF WM SPECIALTY MORTGAGE LLC, ENTERED A PLEA OF ""NOT GUILTY.""  ON SEPTEMBER 24, 2009, THE MORTGAGE SERVICER, ON BEHALF OF WM SPECIALTY MORTGAGE LLC, CHANGED THE PLEA TO ""NO CONTEST.""","N","Pending","","","","THE COURT ACCEPTED THE ""NO CONTEST"" PLEA AND FOUND WM SPECIALTY MORTGAGE LLC GUILTY ON SEPTEMBER 24, 2009.  THE COURT ASSESSED A FINE OF $25,700.00 PLUS THE COST OF THE ACTION ON THE SAME DATE.  THE FINE AMOUNT IS CURRENTLY OUTSTANDING.  ON JANUARY 19, 2010, THE MORTGAGE SERVICER, ON BEHALF OF WM SPECIALTY MORTGAGE LLC, FILED A MOTION TO EXTEND THE PAYMENT DEADLINE TO PROVIDE WM SPECIALTY MORTGAGE LLC TIME TO MITIGATE THE FINE BY ABATING THE NUISANCE.  THE COURT GRANTED THE EXTENSION ON JANUARY 28, 2010.  ON OCTOBER 8, 2010 A MOTION TO WITHDRAW THE ""NO CONTEST"" PLEA WAS FILED BASED UPON THE BELIEF THAT, ALTHOUGH WM SPECIALTY MORTGAGE LLC FORECLOSED ON THE PROPERTY, TITLE WAS NEVER TRANSFERRED INTO WM SPECIALTY MORTGAGE LLC'S NAME PER THE AUDITOR'S RECORDS.  WM SPECIALTY MORTGAGE LLC IS CURRENTLY WAITING ON A RULING FROM THE COURT.","WM SPECIALTY MORTGAGE LLC, THE OWNER OF REAL ESTATE LOCATED IN CLEVELAND, OHIO, WAS CITED ON AUGUST 20, 2008 FOR VIOLATING CLEVELAND BUILDING AND HOUSING ORDINANCES, INCLUDING STRUCTURAL AND AESTHETIC VIOLATIONS."
1025164,"INITIAL","","","Y","Y","Affiliates",1482933,"","","","","N","JPMORGAN CHASE BANK, N.A. ENGAGES IN INVESTMENT-RELATED BUSINESS AND IS A DIRECT SUBSIDIARY OF JPMORGAN CHASE & CO. UNDER COMMON CONTROL WITH (BUT NOT CONTROLLING OR CONTROLLED BY) J.P. MORGAN SECURITIES LLC.","CLEVELAND MUNICIPAL COURT; CLEVELAND, OHIO; 2009-CRB-025029.","07/25/2009","Y","","JPMORGAN CHASE BANK, N.A. WAS CHARGED ON JULY 25, 2009 WITH VIOLATING CITY OF CLEVELAND HOUSING CODE SECTION 3103.10.  SUCH VIOLATION IS A MISDEMEANOR UNDER CLEVELAND LAW.  ON AUGUST 6, 2009, A MORTGAGE SERVICER, ON BEHALF OF JPMORGAN CHASE BANK, N.A., ENTERED A PLEA OF ""NOT GUILTY.""  ON SEPTEMBER 16, 2009, THE MORTGAGE SERVICER, ON BEHALF OF JPMORGAN CHASE BANK, N.A., CHANGED THE PLEA TO ""NO CONTEST.""","N","Final","09/16/2009","Y","","THE COURT ACCEPTED THE ""NO CONTEST"" PLEA AND FOUND JPMORGAN CHASE BANK, N.A.  GUILTY ON SEPTEMBER 16, 2009.  THE COURT ASSESSED A $500.00 FINE ON THE SAME DATE.  ON OR ABOUT JANUARY 13, 2010, THE FINE WAS PAID AND THE CASE WAS CLOSED.","JPMORGAN CHASE BANK, N.A., THE OWNER OF REAL ESTATE LOCATED IN CLEVELAND, OHIO, WAS CITED IN JUNE 2009 FOR VIOLATING CLEVELAND BUILDING AND HOUSING ORDINANCES, INCLUDING LANDSCAPE MAINTENANCE."
1025164,"INITIAL","","","Y","Y","Affiliates",1482934,"","","","","N","JPMORGAN CHASE BANK, N.A. ENGAGES IN INVESTMENT-RELATED BUSINESS AND IS A DIRECT SUBSIDIARY OF JPMORGAN CHASE & CO. UNDER COMMON CONTROL WITH (BUT NOT CONTROLLING OR CONTROLLED BY) J.P. MORGAN SECURITIES LLC.","CLEVELAND MUNICIPAL COURT; CLEVELAND, OHIO; 2007-CRB-027611.","08/13/2007","Y","","JPMORGAN CHASE BANK, N.A. WAS CHARGED ON AUGUST 13, 2007 WITH VIOLATING CITY OF CLEVELAND HOUSING CODE SECTIONS 3103.09, 369.06, 369.07, 369.09, 369.12, 369.13, 369.14, 369.15, 369.16,  AND 369.19.  SUCH VIOLATIONS ARE MISDEMEANORS UNDER CLEVELAND LAW.  ON OCTOBER 17, 2007, A MORTGAGE SERVICER, ON BEHALF OF JPMORGAN CHASE BANK, N.A., ENTERED A PLEA OF ""NOT GUILTY.""  ON MARCH 4, 2008, THE MORTGAGE SERVICER, ON BEHALF OF JPMORGAN CHASE BANK, N.A., CHANGED THE PLEA TO ""NO CONTEST.""","N","Final","03/04/2008","Y","","THE COURT ACCEPTED THE ""NO CONTEST"" PLEA AND FOUND JPMORGAN CHASE BANK, N.A. GUILTY ON MARCH 4, 2008.  THE COURT ASSESSED A FINE OF $10,000.00 PLUS THE COST OF THE ACTION, SUSPENDED $9,000.00 OF THE FINE ON THE SAME DATE, AND DIRECTED JPMORGAN CHASE BANK, N.A. TO REMEDY THE VIOLATIONS OR DEMOLISH THE PROPERTY AT ITS OWN EXPENSE.  JPMORGAN CHASE BANK, N.A. DEMOLISHED THE PROPERTY AT ITS OWN EXPENSE.  ON MARCH 31, 2008, THE REMAINING PORTION OF THE FINE WAS PAID AND THE CASE WAS CLOSED.","JPMORGAN CHASE BANK, N.A., THE OWNER OF REAL ESTATE LOCATED IN CLEVELAND, OHIO, WAS CITED IN JUNE 2007 FOR VIOLATING CLEVELAND BUILDING AND HOUSING ORDINANCES."
1025164,"INITIAL","","","Y","Y","Affiliates",1482935,"","","","","N","JPMORGAN CHASE BANK, N.A. ENGAGES IN INVESTMENT-RELATED BUSINESS AND IS A DIRECT  SUBSIDIARY OF JPMORGAN CHASE & CO. UNDER COMMON CONTROL WITH (BUT NOT CONTROLLING OR CONTROLLED BY) J.P. MORGAN SECURITIES LLC.","CLEVELAND MUNICIPAL COURT; CLEVELAND, OHIO; 2008-CRB-013465.","05/13/2008","Y","","JPMORGAN CHASE BANK, N.A. WAS CHARGED ON MAY 13, 2008 WITH VIOLATING CITY OF CLEVELAND HOUSING CODE SECTIONS 3103.10, 369.13, AND 369.15.  SUCH VIOLATIONS ARE MISDEMEANORS UNDER CLEVELAND LAW.  ON JULY 28, 2008, A MORTGAGE SERVICER, ON BEHALF OF JPMORGAN CHASE BANK, N.A., ENTERED A PLEA OF ""NOT GUILTY.""  ON NOVEMBER 25, 2008, THE MORTGAGE SERVICER, ON BEHALF OF JPMORGAN CHASE BANK, N.A., CHANGED THE PLEA TO ""NO CONTEST.""","N","Final","11/25/2008","Y","","THE COURT ACCEPTED THE ""NO CONTEST"" PLEA AND FOUND JPMORGAN CHASE BANK, N.A. GUILTY ON NOVEMBER 25, 2008.  THE COURT ASSESSED A FINE OF $20,000.00 PLUS THE COST OF THE ACTION, SUSPENDED $18,000.00 OF THE FINE ON THE SAME DATE, AND DIRECTED JPMORGAN CHASE BANK, N.A. TO REMEDY THE VIOLATIONS OR DEMOLISH THE PROPERTY AT ITS OWN EXPENSE.  THE VIOLATIONS WERE REMEDIED.  JPMORGAN CHASE BANK, N.A. WAS PLACED ON INACTIVE PROBATION UNTIL THE FINE WAS PAID.  ON APRIL 29, 2009, THE REMAINING PORTION OF THE FINE WAS PAID AND THE CASE WAS CLOSED.","JPMORGAN CHASE BANK, N.A., THE OWNER OF REAL ESTATE LOCATED IN CLEVELAND, OHIO, WAS CITED IN MARCH 2008 FOR VIOLATING CLEVELAND BUILDING AND HOUSING ORDINANCES."
1025164,"INITIAL","","","Y","Y","Affiliates",1482936,"","","","","N","JPMORGAN CHASE BANK, N.A. ENGAGES IN INVESTMENT-RELATED BUSINESS AND IS A DIRECT SUBSIDIARY OF JPMORGAN CHASE & CO. UNDER COMMON CONTROL WITH (BUT NOT CONTROLLING OR CONTROLLED BY) J.P. MORGAN SECURITIES LLC.","CLEVELAND MUNICIPAL COURT; CLEVELAND, OHIO; 2007-CRB-010656.","04/12/2007","Y","","JPMORGAN CHASE BANK, N.A. WAS CHARGED ON APRIL 12, 2007 WITH VIOLATING CITY OF CLEVELAND HOUSING CODE SECTIONS 3103.10, 357.13, 369.13, AND 369.15.  SUCH VIOLATIONS ARE MISDEMEANORS UNDER CLEVELAND LAW.  ON OCTOBER 17, 2007, A MORTGAGE SERVICER, ON BEHALF OF JPMORGAN CHASE BANK, N.A., ENTERED A PLEA OF ""NOT GUILTY.""  ON DECEMBER 4, 2007, THE MORTGAGE SERVICER, ON BEHALF OF JPMORGAN CHASE BANK, N.A., CHANGED THE PLEA TO ""NO CONTEST.""","N","Final","12/04/2007","Y","","THE COURT ACCEPTED THE ""NO CONTEST"" PLEA AND FOUND JPMORGAN CHASE BANK, N.A. GUILTY ON DECEMBER 4, 2007.  THE COURT ASSESSED A FINE OF A $10,000.00 PLUS THE COST OF THE ACTION ON THE SAME DATE.  ON JANUARY 22, 2008, THE COURT SUSPENDED $9,000.00 OF THE FINE AND DIRECTED JPMORGAN CHASE BANK, N.A. TO REMEDY THE VIOLATIONS OR DEMOLISH THE PROPERTY AT ITS OWN EXPENSE.  THE VIOLATIONS WERE REMEDIED.  JPMORGAN CHASE BANK, N.A.  WAS PLACED ON INACTIVE PROBATION UNTIL THE FINE WAS PAID.  ON OR ABOUT APRIL 18, 2008, THE REMAINING PORTION OF THE FINE WAS PAID AND THE CASE WAS CLOSED.","JPMORGAN CHASE BANK, N.A., THE OWNER OF REAL ESTATE LOCATED IN CLEVELAND, OHIO, WAS CITED ON JANUARY 3, 2007 FOR VIOLATING CLEVELAND BUILDING AND HOUSING ORDINANCES, INCLUDING LANDSCAPE MAINTENANCE."
1025576,"AMENDED","","Y","","","Affiliates",1015172,"","","","","N","DEUTSCHE BANK AG - DIMA'S INDIRECT PARENT","U.S. DEPARTMENT OF JUSTICE, UNITED STATES DISTRICT COURT, DISTRICT OF CONNECTICUT","04/23/2015","Y","","DEUTSCHE BANK AG (""DBAG""), DIMA'S INDIRECT PARENT ENTERED INTO A THREE-YEAR DEFERRED PROSECUTION AGREEMENT TO SETTLE WIRE FRAUD AND ANTITRUST CHARGES IN CONNECTION WITH MANIPULATIVE ACTIVITY RELATING TO US DOLLAR LIBOR AND ANTI-COMPETITIVE CONDUCT RELATING TO YEN LIBOR. DBAG ALSO AGREED TO PAY A FINE OF $625 MILLION. THE FINE WAS PAID ON 5/1/15 AND DBAG AGREED TO INSTALL A MONITOR FOR A PERIOD OF THREE YEARS, WHICH WILL BE CHARGED WITH OVERSEEING THE BANK'S COMPLIANCE CONTROLS AMONGST OTHER ISSUES.","Y","Pending","","","","",""
